titre,prix,instock,rating
A Light in the Attic,51.77,Instock,3
Tipping the Velvet,53.74,Instock,1
Soumission,50.1,Instock,1
Sharp Objects,47.82,Instock,4
Sapiens: A Brief History of Humankind,54.23,Instock,5
The Requiem Red,22.65,Instock,1
The Dirty Little Secrets of Getting Your Dream Job,33.34,Instock,4
"The Coming Woman: A Novel Based on the Life of the Infamous Feminist, Victoria Woodhull",17.93,Instock,3
The Boys in the Boat: Nine Americans and Their Epic Quest for Gold at the 1936 Berlin Olympics,22.6,Instock,4
The Black Maria,52.15,Instock,1
"Starving Hearts (Triangular Trade Trilogy, #1)",13.99,Instock,2
Shakespeare's Sonnets,20.66,Instock,4
Set Me Free,17.46,Instock,5
Scott Pilgrim's Precious Little Life (Scott Pilgrim #1),52.29,Instock,5
Rip it Up and Start Again,35.02,Instock,5
"Our Band Could Be Your Life: Scenes from the American Indie Underground, 1981-1991",57.25,Instock,3
Olio,23.88,Instock,1
Mesaerion: The Best Science Fiction Stories 1800-1849,37.59,Instock,1
Libertarianism for Beginners,51.33,Instock,2
It's Only the Himalayas,45.17,Instock,2
In Her Wake,12.84,Instock,1
How Music Works,37.32,Instock,2
"Foolproof Preserving: A Guide to Small Batch Jams, Jellies, Pickles, Condiments, and More: A Foolproof Guide to Making Small Batch Jams, Jellies, Pickles, Condiments, and More",30.52,Instock,3
Chase Me (Paris Nights #2),25.27,Instock,5
Black Dust,34.53,Instock,5
Birdsong: A Story in Pictures,54.64,Instock,3
America's Cradle of Quarterbacks: Western Pennsylvania's Football Factory from Johnny Unitas to Joe Montana,22.5,Instock,3
Aladdin and His Wonderful Lamp,53.13,Instock,3
Worlds Elsewhere: Journeys Around Shakespeare’s Globe,40.3,Instock,5
Wall and Piece,44.18,Instock,4
The Four Agreements: A Practical Guide to Personal Freedom,17.66,Instock,5
The Five Love Languages: How to Express Heartfelt Commitment to Your Mate,31.05,Instock,3
The Elephant Tree,23.82,Instock,5
The Bear and the Piano,36.89,Instock,1
Sophie's World,15.94,Instock,5
Penny Maybe,33.29,Instock,3
Maude (1883-1993):She Grew Up with the country,18.02,Instock,2
"In a Dark, Dark Wood",19.63,Instock,1
Behind Closed Doors,52.22,Instock,4
You can't bury them all: Poems,33.63,Instock,2
Slow States of Collapse: Poems,57.31,Instock,3
Reasons to Stay Alive,26.41,Instock,2
Private Paris (Private #10),47.61,Instock,5
#HigherSelfie: Wake Up Your Life. Free Your Soul. Find Your Tribe.,23.11,Instock,5
Without Borders (Wanderlove #1),45.07,Instock,2
When We Collided,31.77,Instock,1
"We Love You, Charlie Freeman",50.27,Instock,5
Untitled Collection: Sabbath Poems 2014,14.27,Instock,4
"Unseen City: The Majesty of Pigeons, the Discreet Charm of Snails & Other Wonders of the Urban Wilderness",44.18,Instock,4
Unicorn Tracks,18.78,Instock,3
"Unbound: How Eight Technologies Made Us Human, Transformed Society, and Brought Our World to the Brink",25.52,Instock,1
Tsubasa: WoRLD CHRoNiCLE 2 (Tsubasa WoRLD CHRoNiCLE #2),16.28,Instock,1
Throwing Rocks at the Google Bus: How Growth Became the Enemy of Prosperity,31.12,Instock,3
This One Summer,19.49,Instock,4
Thirst,17.27,Instock,5
The Torch Is Passed: A Harding Family Story,19.09,Instock,1
The Secret of Dreadwillow Carse,56.13,Instock,1
"The Pioneer Woman Cooks: Dinnertime: Comfort Classics, Freezer Food, 16-Minute Meals, and Other Delicious Ways to Solve Supper!",56.41,Instock,1
The Past Never Ends,56.5,Instock,4
The Natural History of Us (The Fine Art of Pretending #2),45.22,Instock,3
The Nameless City (The Nameless City #1),38.16,Instock,4
The Murder That Never Was (Forensic Instincts #5),54.11,Instock,3
The Most Perfect Thing: Inside (and Outside) a Bird's Egg,42.96,Instock,4
"The Mindfulness and Acceptance Workbook for Anxiety: A Guide to Breaking Free from Anxiety, Phobias, and Worry Using Acceptance and Commitment Therapy",23.89,Instock,4
The Life-Changing Magic of Tidying Up: The Japanese Art of Decluttering and Organizing,16.77,Instock,3
"The Inefficiency Assassin: Time Management Tactics for Working Smarter, Not Longer",20.59,Instock,5
The Gutsy Girl: Escapades for Your Life of Epic Adventure,37.13,Instock,1
The Electric Pencil: Drawings from Inside State Hospital No. 3,56.06,Instock,1
The Death of Humanity: and the Case for Life,58.11,Instock,4
"The Bulletproof Diet: Lose up to a Pound a Day, Reclaim Energy and Focus, Upgrade Your Life",49.05,Instock,3
The Art Forger,40.76,Instock,3
The Age of Genius: The Seventeenth Century and the Birth of the Modern Mind,19.73,Instock,1
The Activist's Tao Te Ching: Ancient Advice for a Modern Revolution,32.24,Instock,5
Spark Joy: An Illustrated Master Class on the Art of Organizing and Tidying Up,41.83,Instock,4
Soul Reader,39.58,Instock,2
Security,39.25,Instock,2
"Saga, Volume 6 (Saga (Collected Editions) #6)",25.02,Instock,3
"Saga, Volume 5 (Saga (Collected Editions) #5)",51.04,Instock,2
Reskilling America: Learning to Labor in the Twenty-First Century,19.83,Instock,2
"Rat Queens, Vol. 3: Demons (Rat Queens (Collected Editions) #11-15)",50.4,Instock,3
"Princess Jellyfish 2-in-1 Omnibus, Vol. 01 (Princess Jellyfish 2-in-1 Omnibus #1)",13.61,Instock,5
Princess Between Worlds (Wide-Awake Princess #5),13.34,Instock,5
"Pop Gun War, Volume 1: Gift",18.97,Instock,1
"Political Suicide: Missteps, Peccadilloes, Bad Calls, Backroom Hijinx, Sordid Pasts, Rotten Breaks, and Just Plain Dumb Mistakes in the Annals of American Politics",36.28,Instock,2
Patience,10.16,Instock,3
"Outcast, Vol. 1: A Darkness Surrounds Him (Outcast #1)",15.44,Instock,4
orange: The Complete Collection 1 (orange: The Complete Collection #1),48.41,Instock,1
Online Marketing for Busy Authors: A Step-By-Step Guide,46.35,Instock,1
On a Midnight Clear,14.07,Instock,3
Obsidian (Lux #1),14.86,Instock,2
My Paris Kitchen: Recipes and Stories,33.37,Instock,2
Masks and Shadows,56.4,Instock,2
"Mama Tried: Traditional Italian Cooking for the Screwed, Crude, Vegan, and Tattooed",14.02,Instock,4
"Lumberjanes, Vol. 2: Friendship to the Max (Lumberjanes #5-8)",46.91,Instock,2
"Lumberjanes, Vol. 1: Beware the Kitten Holy (Lumberjanes #1-4)",45.61,Instock,3
Lumberjanes Vol. 3: A Terrible Plan (Lumberjanes #9-12),19.92,Instock,2
"Layered: Baking, Building, and Styling Spectacular Cakes",40.11,Instock,1
Judo: Seven Steps to Black Belt (an Introductory Guide for Beginners),53.9,Instock,2
Join,35.67,Instock,5
In the Country We Love: My Family Divided,22.0,Instock,4
Immunity: How Elie Metchnikoff Changed the Course of Modern Medicine,57.36,Instock,5
"I Hate Fairyland, Vol. 1: Madly Ever After (I Hate Fairyland (Compilations) #1-5)",29.17,Instock,2
I am a Hero Omnibus Volume 1,54.63,Instock,3
How to Be Miserable: 40 Strategies You Already Use,46.03,Instock,1
Her Backup Boyfriend (The Sorensen Family #1),33.97,Instock,1
"Giant Days, Vol. 2 (Giant Days #5-8)",22.11,Instock,2
Forever and Forever: The Courtship of Henry Longfellow and Fanny Appleton,29.69,Instock,3
First and First (Five Boroughs #3),15.97,Instock,4
Fifty Shades Darker (Fifty Shades #2),21.96,Instock,1
Everydata: The Misinformation Hidden in the Little Data You Consume Every Day,54.35,Instock,2
"Don't Be a Jerk: And Other Practical Advice from Dogen, Japan's Greatest Zen Master",37.97,Instock,2
Danganronpa Volume 1,51.99,Instock,4
Crown of Midnight (Throne of Glass #2),43.29,Instock,3
"Codename Baboushka, Volume 1: The Conclave of Death",36.72,Instock,4
Camp Midnight,17.08,Instock,4
Call the Nurse: True Stories of a Country Nurse on a Scottish Isle,29.14,Instock,5
Burning,28.81,Instock,3
Bossypants,49.46,Instock,2
"Bitch Planet, Vol. 1: Extraordinary Machine (Bitch Planet (Collected Editions))",37.92,Instock,2
"Avatar: The Last Airbender: Smoke and Shadow, Part 3 (Smoke and Shadow #3)",28.09,Instock,2
